Symbol,Name,Last Sale,Net Change,% Change,Market Cap,Country,IPO Year,Volume,Sector,Industry
DAR,Darling Ingredients Inc. Common Stock,$74.98,-0.83,-1.095%,12132379811.00,United States,,556854,Consumer Non-Durables,Farming/Seeds/Milling
DASH,DoorDash Inc. Class A Common Stock,$229.55,-5.10,-2.173%,78748706574.00,,2020,2309035,Capital Goods,Industrial Machinery/Components
DAVA,Endava plc American Depositary Shares (each representing one Class A Ordinary Share),$166.01,1.22,0.74%,9295580043.00,,2018,82409,Technology,EDP Services
DB,Deutsche Bank AG Common Stock,$12.99,0.28,2.203%,27214050000.00,Germany,,1848801,Finance,Commercial Banks
DBD,Diebold Nixdorf Incorporated Common Stock,$9.17,0.34,3.851%,718517670.00,United States,,999856,Technology,EDP Services
DBI,Designer Brands Inc. Class A Common Stock,$16.15,-0.14,-0.859%,1178944299.00,United States,,522711,Consumer Services,Clothing/Shoe/Accessory Stores
DBRG,DigitalBridge Group Inc.,$7.635,-0.275,-3.477%,3925531341.00,United States,2014,1728612,Consumer Services,Real Estate Investment Trusts
DCI,Donaldson Company Inc. Common Stock,$61.405,-0.875,-1.405%,7589357975.00,United States,,136833,Capital Goods,Pollution Control Equipment
DCO,Ducommun Incorporated Common Stock,$48.03,-0.81,-1.658%,572670768.00,United States,,6714,Capital Goods,Military/Government/Technical
DCP,DCP Midstream  LP Common Units ,$29.425,-1.375,-4.464%,6131395299.00,United States,,212204,Public Utilities,Natural Gas Distribution
DD,DuPont de Nemours Inc. Common Stock,$79.09,1.50,1.933%,40976832864.00,,2017,1107488,Capital Goods,Wholesale Distributors
DDD,3D Systems Corporation Common Stock,$25.66,-0.22,-0.85%,3277535095.00,United States,,1873191,Technology,Computer peripheral equipment
DDL,Dingdong (Cayman) Limited American Depositary Shares (each two representing three Ordinary Shares),$25.305,-0.965,-3.673%,5973278982.00,,2021,74523,,
DDS,Dillard's Inc. Common Stock,$347.34,-13.01,-3.61%,7159805560.00,United States,,154039,Consumer Services,Department/Specialty Retail Stores
DE,Deere & Company Common Stock,$353.93,-8.08,-2.232%,109740058909.00,United States,,942185,Capital Goods,Industrial Machinery/Components
DEA,Easterly Government Properties Inc. Common Stock,$21.21,-0.08,-0.376%,1826987786.00,United States,2015,424576,Consumer Services,Real Estate Investment Trusts
DECK,Deckers Outdoor Corporation Common Stock,$432.23,3.53,0.823%,11863900908.00,United States,1993,105228,Consumer Non-Durables,Shoe Manufacturing
DEI,Douglas Emmett Inc. Common Stock,$35.62,-0.42,-1.165%,6250803484.00,United States,2006,428416,Consumer Services,Real Estate Investment Trusts
DELL,Dell Technologies Inc. Class C Common Stock ,$56.16,-0.54,-0.952%,43062938531.00,,2018,1671079,Technology,Computer Manufacturing
DEN,Denbury Inc. Common Stock,$84.25,-0.18,-0.213%,4222813632.00,,2020,251442,Energy,Oil & Gas Production
DEO,Diageo plc Common Stock,$209.12,2.51,1.215%,121881761340.00,United Kingdom,,220193,Consumer Non-Durables,Beverages (Production/Distribution)
DESP,Despegar.com Corp. Ordinary Shares,$11.74,0.61,5.481%,822966111.00,,2017,677637,Transportation,Other Consumer Services
DFIN,Donnelley Financial Solutions Inc. Common Stock ,$48.60,-0.27,-0.552%,1610791110.00,,2016,149509,Finance,Investment Managers
DFP,Flaherty & Crumrine Dynamic Preferred and Income Fund Inc. Common Stock,$28.679,-0.051,-0.178%,555593564.00,,2013,30136,Finance,Investment Managers
DFS,Discover Financial Services Common Stock,$116.155,-1.085,-0.925%,34265725000.00,United States,,711357,Finance,Finance: Consumer Services
DG,Dollar General Corporation Common Stock,$221.38,-8.95,-3.886%,51650216061.00,United States,2009,1668442,Consumer Services,Department/Specialty Retail Stores
DGX,Quest Diagnostics Incorporated Common Stock,$148.86,0.86,0.581%,18261366411.00,United States,,271282,Health Care,Medical Specialities
DHI,D.R. Horton Inc. Common Stock,$101.525,2.415,2.437%,36144508461.00,United States,,1808071,,
DHR,Danaher Corporation Common Stock,$309.73,4.14,1.355%,221325893326.00,United States,,1190107,Health Care,Medical Specialities
DHT,DHT Holdings Inc.,$5.92,0.03,0.509%,986792256.00,Jersey,2005,714400,Transportation,Marine Transportation
DIAX,Nuveen Dow 30SM Dynamic Overwrite Fund Common Shares of Beneficial Interest,$17.84,-0.11,-0.613%,648785728.00,,2014,31599,Finance,Finance Companies
DIDI,DiDi Global Inc. American Depositary Shares (each four representing one Class A Ordinary Share),$8.615,-0.385,-4.278%,41552225316.00,,2021,11494328,,
DIN,Dine Brands Global Inc. Common Stock,$85.155,1.605,1.921%,1466115594.00,United States,,76252,Consumer Services,Restaurants
DIS,Walt Disney Company (The) Common Stock,$157.24,-1.59,-1.001%,285724985798.00,United States,,9925736,Consumer Services,Movies/Entertainment
DK,Delek US Holdings Inc. Common Stock,$17.06,-1.21,-6.623%,1264571425.00,United States,2017,468846,Energy,Integrated oil Companies
DKL,Delek Logistics Partners L.P. Common Units representing Limited Partner Interests,$45.72,-0.42,-0.91%,1986948360.00,United States,2012,14673,Energy,Oil & Gas Production
DKS,Dick's Sporting Goods Inc Common Stock,$135.37,-2.68,-1.941%,11992142805.00,United States,2002,905756,Consumer Services,Other Specialty Stores
DLB,Dolby Laboratories Common Stock,$87.155,-1.795,-2.018%,8836425471.00,United States,2005,572758,Technology,EDP Services
DLR,Digital Realty Trust Inc. Common Stock,$162.775,1.065,0.659%,46193503150.00,United States,2004,543294,Consumer Services,Real Estate Investment Trusts
DLX,Deluxe Corporation Common Stock,$37.48,-0.31,-0.82%,1596866209.00,United States,,45900,Technology,Advertising
DLY,DoubleLine Yield Opportunities Fund Common Shares of Beneficial Interest,$19.0937,-0.1563,-0.812%,915462320.00,,2020,79272,Finance,Investment Managers
DM,Desktop Metal Inc. Class A Common Stock,$6.95,0.12,1.757%,2146719892.00,,2019,6459340,Technology,Industrial Machinery/Components
DMS,Digital Media Solutions Inc. Class A Ordinary Shares,$6.06,-0.22,-3.503%,375057357.00,United States,2018,27116,Technology,Advertising
DMYQ,dMY Technology Group Inc. IV Class A Common Stock,$11.17,0.30,2.76%,481706250.00,,2021,4261068,,
DNA,Ginkgo Bioworks Holdings Inc. Class A Common Stock,$13.70,-0.30,-2.143%,26816229245.00,United States,2021,2138550,Health Care,Biotechnology: Biological Products (No Diagnostic Substances)
DNB,Dun & Bradstreet Holdings Inc. Common Stock,$19.70,0.20,1.026%,8494424837.00,United States,2020,952014,Technology,EDP Services
DNMR,Danimer Scientific Inc. Common Stock,$15.92,1.16,7.859%,1555894698.00,,2020,1885107,Basic Industries,Major Chemicals
DNOW,NOW Inc. Common Stock,$9.89,-0.23,-2.273%,1093426839.00,,2014,669076,Energy,Metal Fabrications
DNP,DNP Select Income Fund Inc. Common Stock,$10.865,-0.035,-0.321%,3704708619.00,United States,1987,273321,Finance,Investment Managers
DNZ,D and Z Media Acquisition Corp. Class A Common Stock,$9.74,-0.01,-0.103%,350031250.00,,2021,200,,
DOC,Physicians Realty Trust Common Shares of Beneficial Interest,$18.41,0.08,0.436%,4055529400.00,United States,2013,722441,Consumer Services,Real Estate Investment Trusts
DOCN,DigitalOcean Holdings Inc. Common Stock,$130.555,0.295,0.226%,14252220527.00,,2021,1090640,Technology,Retail: Computer Software & Peripheral Equipment
DOCS,Doximity Inc. Class A Common Stock,$68.32,0.52,0.767%,12810759718.00,,2021,1559525,Technology,Retail: Computer Software & Peripheral Equipment
DOLE,Dole plc Ordinary Shares,$13.79,-0.14,-1.005%,1283830301.00,,2021,433602,,
DOMA,Doma Holdings Inc. Common Stock,$7.60,0.09,1.198%,2451564239.00,,2021,296900,Finance,Real Estate
DOOR,Masonite International Corporation Ordinary Shares (Canada),$114.58,-2.27,-1.943%,2724593008.00,Canada,,63545,,
DOV,Dover Corporation Common Stock,$175.22,-1.41,-0.798%,25228990899.00,United States,,170648,Capital Goods,Industrial Machinery/Components
DOW,Dow Inc. Common Stock ,$58.655,-0.205,-0.348%,43382083336.00,,2019,1601004,Basic Industries,Industrial Specialties
DPG,Duff & Phelps Utility and Infrastructure Fund Inc.,$14.24,-0.07,-0.489%,540120437.00,United States,2011,62253,Finance,Trusts Except Educational Religious and Charitable
DPZ,Domino's Pizza Inc Common Stock,$530.9125,5.6625,1.078%,19304160072.00,United States,2004,168798,Consumer Non-Durables,Food Distributors
DQ,DAQO New Energy Corp. American Depositary Shares each representing five ordinary shares,$68.50,-0.71,-1.026%,5035680230.00,China,2010,335578,Technology,Semiconductors
DRD,DRDGOLD Limited American Depositary Shares,$9.95,0.13,1.324%,850838221.00,South Africa,,71957,Basic Industries,Precious Metals
DRE,Duke Realty Corporation Common Stock,$57.82,0.07,0.121%,22020764346.00,United States,,380478,Consumer Services,Real Estate Investment Trusts
DRH,Diamondrock Hospitality Company Common Stock,$9.79,-0.13,-1.31%,2061968234.00,United States,2005,523938,Consumer Services,Real Estate Investment Trusts
DRI,Darden Restaurants Inc. Common Stock,$147.235,0.615,0.419%,19108894917.00,United States,,313584,Consumer Services,Restaurants
DRQ,Dril-Quip Inc. Common Stock,$20.50,-0.29,-1.395%,725410643.00,United States,1997,402814,Energy,Metal Fabrications
DSL,DoubleLine Income Solutions Fund Common Shares of Beneficial Interests,$17.145,-0.145,-0.839%,1748735616.00,,2013,254172,Finance,Trusts Except Educational Religious and Charitable
DSM,BNY Mellon Strategic Municipal Bond Fund Inc. Common Stock,$8.15,-0.05,-0.61%,402785315.00,United States,1989,31953,Finance,Investment Managers
DSU,Blackrock Debt Strategies Fund Inc. Common Stock,$11.82,0.02,0.169%,550715159.00,United States,1998,57770,Finance,Finance Companies
DSX,Diana Shipping inc. common stock,$4.2236,-0.3264,-7.174%,386607234.00,Greece,2005,774889,Transportation,Marine Transportation
DT,Dynatrace Inc. Common Stock,$69.0673,-1.2927,-1.837%,19689098713.00,United States,2019,1074005,Technology,EDP Services
DTC,Solo Brands Inc. Class A Common Stock,$19.81,0.25,1.278%,1217565231.00,,2021,257475,Miscellaneous,Diversified Commercial Services
DTE,DTE Energy Company Common Stock,$112.06,-0.73,-0.647%,21709078773.00,United States,,669213,Public Utilities,Electric Utilities: Central
DTM,DT Midstream Inc. Common Stock ,$47.73,-0.13,-0.272%,4617040602.00,,2021,151414,Public Utilities,Oil & Gas Production
DUK,Duke Energy Corporation (Holding Company) Common Stock,$98.59,-0.49,-0.495%,75849563045.00,United States,,1103310,Public Utilities,Power Generation
DV,DoubleVerify Holdings Inc. Common Stock,$31.435,-1.705,-5.145%,4986787668.00,,2021,395341,Technology,Computer Software: Prepackaged Software
DVA,DaVita Inc. Common Stock,$100.65,-0.91,-0.896%,10256235000.00,United States,,521216,Health Care,Medical/Nursing Services
DVN,Devon Energy Corporation Common Stock,$42.955,-0.475,-1.094%,29080535000.00,United States,,3914176,Energy,Oil & Gas Production
DX,Dynex Capital Inc. Common Stock,$17.755,-0.065,-0.365%,651001368.00,United States,,317667,Consumer Services,Real Estate Investment Trusts
DXC,DXC Technology Company Common Stock ,$32.45,0.17,0.527%,8185149579.00,,,542861,Technology,EDP Services
DY,Dycom Industries Inc. Common Stock,$84.65,-1.13,-1.317%,2553941290.00,United States,,67501,Basic Industries,Water Supply
E,ENI S.p.A. Common Stock,$28.49,-0.10,-0.35%,50597459773.00,Italy,,191330,Energy,Oil & Gas Production
EAF,GrafTech International Ltd. Common Stock,$12.785,-0.405,-3.071%,3365295929.00,United States,2018,702275,Consumer Durables,Metal Fabrications
EAT,Brinker International Inc. Common Stock,$41.32,0.51,1.25%,1876651596.00,United States,,440825,Consumer Services,Restaurants
EB,Eventbrite Inc. Class A Common Stock,$20.25,-0.34,-1.651%,1923937211.00,United States,2018,412676,Technology,EDP Services
EBF,Ennis Inc. Common Stock,$19.62,-0.23,-1.159%,512503104.00,United States,,23453,Consumer Services,Office Equipment/Supplies/Services
EBR,Centrais Electricas Brasileiras S A American Depositary Shares (Each representing one Common Share),$5.86,-0.45,-7.132%,9193935133.00,,2016,1325201,Public Utilities,Electric Utilities: Central
EBS,Emergent Biosolutions Inc. Common Stock,$41.19,0.34,0.832%,2215966970.00,United States,2006,350310,Health Care,Biotechnology: Pharmaceutical Preparations
EC,Ecopetrol S.A. American Depositary Shares,$13.92,-0.32,-2.247%,28617219497.00,Colombia,,540718,Energy,Oil & Gas Production
ECC           ,Eagle Point Credit Company Inc. Common Stock,$15.20,0.24,1.604%,524241297.00,United States,2014,191440,Finance,Trusts Except Educational Religious and Charitable
ECL,Ecolab Inc. Common Stock,$232.24,-1.19,-0.51%,66552391378.00,United States,,211870,Consumer Non-Durables,Package Goods/Cosmetics
ECOM          ,ChannelAdvisor Corporation Common Stock,$27.36,-0.20,-0.726%,822139217.00,United States,2013,51352,Technology,Computer Software: Prepackaged Software
ECVT,Ecovyst Inc. Common Stock,$10.705,-2.015,-15.841%,1467224185.00,United States,2017,684547,Basic Industries,Major Chemicals
ED,Consolidated Edison Inc. Common Stock,$77.20,-0.32,-0.413%,27309402419.00,United States,,880478,Public Utilities,Power Generation
EDD,Morgan Stanley Emerging Markets Domestic Debt Fund Inc. Morgan Stanley Emerging Markets Domestic Debt Fund Inc. Common Stock,$5.86,-0.01,-0.17%,387299853.00,United States,2007,62332,Finance,Finance Companies
EDR,Endeavor Group Holdings Inc. Class A Common Stock,$30.40,1.82,6.368%,7957666214.00,,2021,2293909,Consumer Services,Movies/Entertainment
EDU,New Oriental Education & Technology Group Inc. Sponsored ADR representing 1 Ordinary Share (Cayman Islands),$2.175,0.025,1.163%,3690901448.00,China,2006,54931802,Miscellaneous,Other Consumer Services
EEX,Emerald Holding Inc. Common Stock,$4.40,-0.08,-1.786%,308587237.00,United States,2017,74080,Technology,Advertising
EFC,Ellington Financial Inc. Common Stock ,$17.735,-0.145,-0.811%,1018479674.00,United States,2010,406971,Finance,Real Estate
EFR,Eaton Vance Senior Floating-Rate Fund Common Shares of Beneficial Interest,$15.33,-0.16,-1.033%,434147915.00,United States,2003,42060,Finance,Trusts Except Educational Religious and Charitable
EFT,Eaton Vance Floating Rate Income Trust Common Shares of Beneficial Interest,$14.97,-0.02,-0.133%,426315406.00,United States,2004,46568,Finance,Finance Companies
EFX,Equifax Inc. Common Stock,$288.80,-2.49,-0.855%,35234038687.00,United States,,335642,Technology,Advertising
EGHT,8x8 Inc Common Stock,$22.22,-0.54,-2.373%,2531964778.00,United States,,202979,Technology,EDP Services
EGO,Eldorado Gold Corporation Ordinary Shares,$9.94,0.04,0.404%,1815513655.00,Canada,,789516,,
EGP,EastGroup Properties Inc. Common Stock,$202.45,-1.59,-0.779%,8236531069.00,United States,,135347,Consumer Services,Real Estate Investment Trusts
EHC,Encompass Health Corporation Common Stock,$63.21,0.25,0.397%,6288920546.00,United States,,339707,Health Care,Medical Specialities
EIG,Employers Holdings Inc Common Stock,$39.21,-0.65,-1.631%,1096483340.00,United States,2007,32603,Finance,Property-Casualty Insurers
EIX,Edison International Common Stock,$64.18,0.41,0.643%,24382511870.00,United States,,792703,Public Utilities,Electric Utilities: Central
EL,Estee Lauder Companies Inc. (The) Common Stock,$355.795,5.475,1.563%,128067483048.00,United States,1995,515726,Consumer Non-Durables,Package Goods/Cosmetics
ELAN,Elanco Animal Health Incorporated Common Stock,$31.97,-0.32,-0.991%,15124963617.00,United States,2018,1676975,Health Care,Biotechnology: Pharmaceutical Preparations
ELF,e.l.f. Beauty Inc. Common Stock,$32.78,0.41,1.267%,1705590472.00,United States,2016,177775,Consumer Non-Durables,Package Goods/Cosmetics
ELP,Companhia Paranaense de Energia (COPEL) American Depositary Shares (each representing one Unit consisting one Common Share and four non-voting Class B Preferred Shares),$5.355,-0.125,-2.281%,14654245331.00,Brazil,2021,364641,Public Utilities,Electric Utilities: Central
ELS,Equity Lifestyle Properties Inc. Common Stock,$84.33,0.11,0.131%,15502056362.00,United States,,180631,Consumer Services,Real Estate Investment Trusts
ELY,Callaway Golf Company Common Stock,$30.08,-0.45,-1.474%,5595295164.00,United States,1992,789148,Consumer Non-Durables,Recreational Products/Toys
EMD,Western Asset Emerging Markets Debt Fund Inc Common Stock,$13.68,-0.12,-0.87%,831005444.00,United States,,44115,Finance,Finance/Investors Services
EME,EMCOR Group Inc. Common Stock,$128.845,-1.075,-0.827%,6877022506.00,United States,,52598,Capital Goods,Engineering & Construction
EMN,Eastman Chemical Company Common Stock,$114.80,0.13,0.113%,15433744029.00,United States,,289439,Basic Industries,Major Chemicals
EMO,ClearBridge Energy Midstream Opportunity Fund Inc. Common Stock,$23.83,-0.46,-1.894%,317108622.00,United States,2011,36515,Finance,Investment Managers
EMR,Emerson Electric Company Common Stock,$94.43,-1.78,-1.85%,56450254000.00,United States,,1575490,Capital Goods,Industrial Machinery/Components
ENB,Enbridge Inc Common Stock,$40.17,-0.16,-0.397%,81382913826.00,Canada,,1718036,Energy,Oil & Gas Production
ENBL,Enable Midstream Partners LP Common Units representing limited partner interests,$7.7044,-0.1656,-2.104%,3358285208.00,,2014,340803,,
ENFN,Enfusion Inc. Class A Common Stock,$21.66,-0.91,-4.032%,1387687776.00,,2021,196429,Technology,Computer Software: Prepackaged Software
ENIA,Enel Americas S.A. American Depositary Shares,$5.54,-0.27,-4.647%,11886812199.00,Chile,,421008,Public Utilities,Electric Utilities: Central
ENIC,Enel Chile S.A. American Depositary Shares (Each representing 50 shares of Common Stock),$1.98,-0.10,-4.808%,2738995665.00,,2016,1181846,Public Utilities,Electric Utilities: Central
ENLC,EnLink Midstream LLC Common Units representing Limited Partner Interests,$7.14,-0.07,-0.971%,3484017378.00,,,559034,Public Utilities,Natural Gas Distribution
ENPC,Executive Network Partnering Corporation Class A Common Stock,$9.84,0.01,0.102%,436738560.00,,2020,3289,,
ENR,Energizer Holdings Inc. Common Stock,$38.80,-0.52,-1.322%,2652823008.00,United States,2015,248751,Basic Industries,Metal Fabrications
ENS,EnerSys Common Stock,$78.69,-1.12,-1.403%,3296426240.00,United States,2004,70430,Consumer Non-Durables,Telecommunications Equipment
ENV,Envestnet Inc Common Stock,$81.415,-1.945,-2.333%,4448862672.00,United States,2010,86873,Technology,EDP Services
ENVA,Enova International Inc. Common Stock,$41.38,0.46,1.124%,1507114718.00,United States,2014,73752,Finance,Finance: Consumer Services
EOCW,Elliott Opportunity II Corp. Class A Ordinary Shares,$9.8101,-0.0199,-0.202%,747406994.00,,2021,21712,,
EOG,EOG Resources Inc. Common Stock,$91.24,-0.66,-0.718%,53383609866.00,United States,,2102641,Energy,Oil & Gas Production
EOI,Eaton Vance Enhance Equity Income Fund Eaton Vance Enhanced Equity Income Fund Shares of Beneficial Interest,$20.2094,0.1194,0.594%,794712384.00,United States,2004,21539,Consumer Services,Real Estate Investment Trusts
EOS,Eaton Vance Enhance Equity Income Fund II Common Stock,$24.6744,-0.0356,-0.144%,1254332081.00,,2005,26237,Finance,Trusts Except Educational Religious and Charitable
EOT,Eaton Vance Municipal Income Trust EATON VANCE NATIONAL MUNICIPAL OPPORTUNITIES TRUST,$22.77,0.10,0.441%,350432873.00,United States,2009,7939,Finance,Trusts Except Educational Religious and Charitable
EPAC,Enerpac Tool Group Corp. Common Stock,$22.89,0.02,0.087%,1380051330.00,United States,,75473,Capital Goods,Industrial Machinery/Components
EPAM,EPAM Systems Inc. Common Stock,$665.52,-5.49,-0.818%,37748000906.00,United States,2012,91121,Technology,EDP Services
EPC,Edgewell Personal Care Company Common Stock,$43.52,-0.05,-0.115%,2365889641.00,,,175207,Consumer Non-Durables,Package Goods/Cosmetics
EPD,Enterprise Products Partners L.P. Common Stock,$22.40,-0.70,-3.03%,48879711037.00,United States,,4565930,Public Utilities,Natural Gas Distribution
EPR,EPR Properties Common Stock,$50.535,-0.215,-0.424%,3780292557.00,United States,1997,224546,Consumer Services,Real Estate Investment Trusts
EPRT,Essential Properties Realty Trust Inc. Common Stock,$28.465,-0.375,-1.30%,3460599982.00,United States,2018,190030,Consumer Services,Real Estate Investment Trusts
EPWR,Empowerment & Inclusion Capital I Corp. Class A Common Stock,$9.76,-0.02,-0.204%,336720000.00,,2021,5285,,
EQC,Equity Commonwealth Common Shares of Beneficial Interest,$25.881,-0.119,-0.458%,3129148801.00,United States,,377140,Consumer Services,Real Estate Investment Trusts
EQD,Equity Distribution Acquisition Corp. Class A Common Stock,$9.85,-0.03,-0.304%,509737500.00,United States,2020,300,,
EQH,Equitable Holdings Inc. Common Stock,$33.315,-1.135,-3.295%,13484863710.00,United States,2018,2108751,,
EQNR,Equinor ASA,$26.775,-0.225,-0.833%,86747294286.00,Norway,,1340312,Energy,Integrated oil Companies
EQR,Equity Residential Common Shares of Beneficial Interest,$86.44,-0.25,-0.288%,32416402230.00,United States,,526847,Consumer Services,Real Estate Investment Trusts
EQT,EQT Corporation Common Stock,$21.64,-0.36,-1.636%,8178808959.00,United States,,1908674,Energy,Oil & Gas Production
ERF,Enerplus Corporation Common Stock,$9.895,-0.155,-1.542%,2523225000.00,Canada,,1385221,,
ERJ,Embraer S.A. Common Stock,$14.98,-0.65,-4.159%,2756855924.00,Brazil,2000,2895767,Capital Goods,Aerospace
ERO,Ero Copper Corp. Common Shares,$18.30,-0.02,-0.109%,1641443059.00,,2021,4340,,
ES,Eversource Energy (D/B/A) Common Stock,$83.47,0.10,0.12%,28697471128.00,United States,,424718,Public Utilities,Electric Utilities: Central
ESE,ESCO Technologies Inc. Common Stock,$93.495,0.765,0.825%,2436613585.00,United States,,35008,Capital Goods,Telecommunications Equipment
ESI,Element Solutions Inc. Common Stock,$24.865,-0.465,-1.836%,6154172091.00,United States,2014,714581,Basic Industries,Industrial Specialties
ESM,ESM Acquisition Corporation Class A Ordinary Shares,$9.73,-0.04,-0.409%,373316583.00,,2021,202,Finance,Major Banks
ESMT,EngageSmart Inc. Common Stock,$27.09,-0.69,-2.484%,4380223819.00,,2021,139251,Technology,EDP Services
ESNT,Essent Group Ltd. Common Shares,$45.66,-0.43,-0.933%,5042346900.00,,2013,240894,Finance,Property-Casualty Insurers
ESRT,Empire State Realty Trust Inc. Class A Common Stock,$9.97,-0.28,-2.732%,1729487774.00,United States,2013,721917,Consumer Services,Real Estate Investment Trusts
ESS,Essex Property Trust Inc. Common Stock,$345.35,-0.30,-0.087%,22478082436.00,United States,1994,87373,Consumer Services,Real Estate Investment Trusts
ESTC,Elastic N.V. Ordinary Shares,$183.55,-3.23,-1.729%,16849119090.00,United States,2018,350344,Technology,Computer Software: Prepackaged Software
ESTE,Earthstone Energy Inc. Class A Common Stock,$10.92,-0.22,-1.975%,957194380.00,United States,,100894,Energy,Oil & Gas Production
ET,Energy Transfer LP Common Units ,$9.04,-0.20,-2.165%,24460930755.00,United States,,11085093,Public Utilities,Natural Gas Distribution
ETB,Eaton Vance Tax-Managed Buy-Write Income Fund Eaton Vance Tax-Managed Buy-Write Income Fund Common Shares of Beneficial Interest,$17.00,-0.06,-0.352%,468181921.00,United States,2005,22780,Finance,Trusts Except Educational Religious and Charitable
ETD,Ethan Allen Interiors Inc. Common Stock,$24.27,-1.22,-4.786%,613061074.00,United States,,184109,Consumer Durables,Home Furnishings
ETG,Eaton Vance Tax-Advantaged Global Dividend Income Fund Common Shares of Beneficial Interest,$22.705,-0.105,-0.46%,1732396359.00,United States,2004,51957,Finance,Investment Managers
ETJ,Eaton Vance Risk-Managed Diversified Equity Income Fund Common Shares of Beneficial Interest,$11.53,-0.04,-0.346%,738740440.00,United States,2007,91849,Finance,Finance Companies
ETN,Eaton Corporation PLC Ordinary Shares,$172.63,-1.17,-0.673%,68810318000.00,Ireland,,713891,Capital Goods,Industrial Machinery/Components
ETO,Eaton Vance Tax-Advantage Global Dividend Opp Common Stock,$32.88,-0.26,-0.785%,515598711.00,United States,2004,32218,Finance,Investment Managers
ETR,Entergy Corporation Common Stock,$105.39,0.07,0.066%,21181418996.00,United States,,323954,Public Utilities,Electric Utilities: Central
ETRN,Equitrans Midstream Corporation Common Stock ,$10.415,-0.025,-0.239%,4504497915.00,,2018,727014,Energy,Oilfield Services/Equipment
ETV,Eaton Vance Corporation Eaton Vance Tax-Managed Buy-Write Opportunities Fund Common Shares of Beneficial Interest,$16.695,-0.015,-0.09%,1639152931.00,United States,2005,104445,Finance,Trusts Except Educational Religious and Charitable
ETW,Eaton Vance Corporation Eaton Vance Tax-Managed Global Buy-Write Opportunites Fund Common Shares of Beneficial Interest,$11.02,-0.04,-0.362%,1185354597.00,United States,2005,103545,Finance,Investment Managers
ETWO,E2open Parent Holdings Inc.Class A Common Stock,$12.89,-0.42,-3.156%,3867030317.00,,2020,1026554,Technology,Computer Software: Prepackaged Software
ETY,Eaton Vance Tax-Managed Diversified Equity Income Fund Common Shares of Beneficial Interest,$14.91,-0.01,-0.067%,2266647662.00,United States,2006,129756,Finance,Finance Companies
EURN,Euronav NV Ordinary Shares,$10.005,0.085,0.857%,2017788200.00,,2015,524136,Transportation,Marine Transportation
EVA,Enviva Partners LP Common units representing limited partner interests,$68.345,0.345,0.507%,4170227574.00,United States,2015,38109,,
EVC,Entravision Communications Corporation Common Stock,$8.045,-0.255,-3.072%,687255147.00,United States,2000,537967,Consumer Services,Broadcasting
EVH,Evolent Health Inc Class A Common Stock,$27.98,0.10,0.359%,2501705986.00,United States,2015,278161,Health Care,Managed Health Care
EVN,Eaton Vance Municipal Income Trust Common Stock,$13.66,0.01,0.073%,541853447.00,United States,1999,32072,Finance,Investment Managers
EVR,Evercore Inc. Class A Common Stock,$153.375,-0.615,-0.399%,5984572714.00,United States,2006,176167,Finance,Investment Managers
EVRG,Evergy Inc. Common Stock,$65.46,0.08,0.122%,15010154742.00,,2018,494761,Public Utilities,Power Generation
EVRI,Everi Holdings Inc. Common Stock,$23.84,-0.97,-3.91%,2168930444.00,United States,,269591,Consumer Services,Recreational Products/Toys
