Symbol,Name,Last Sale,Net Change,% Change,Market Cap,Country,IPO Year,Volume,Sector,Industry
ONTO,Onto Innovation Inc. Common Stock,$89.94,-1.12,-1.23%,4432103253.00,United States,,81544,Technology,Semiconductors
OOMA,Ooma Inc. Common Stock,$21.07,-0.42,-1.954%,495145000.00,,2015,22194,Consumer Services,Telecommunications Equipment
OPAD,Offerpad Solutions Inc. Class A Common Stock,$8.40,-0.16,-1.869%,2002099436.00,United States,2020,303295,Finance,Real Estate
OPFI,OppFi Inc. Class A Common Stock,$6.24,-0.21,-3.256%,686180246.00,,2020,279635,Technology,EDP Services
OPY,Oppenheimer Holdings Inc. Class A Common Stock (DE),$52.26,-0.51,-0.966%,659280752.00,United States,,47753,Finance,Investment Bankers/Brokers/Service
OR,Osisko Gold Royalties Ltd Common Shares,$13.35,-0.15,-1.111%,2221250363.00,,2016,260908,,
ORA,Ormat Technologies Inc. Common Stock,$79.28,-0.48,-0.602%,4439798999.00,United States,2004,107978,Public Utilities,Electric Utilities: Central
ORAN,Orange,$11.061,-0.049,-0.441%,29414889879.00,France,,707194,Public Utilities,Telecommunications Equipment
ORC,Orchid Island Capital Inc. Common Stock,$4.865,-0.055,-1.118%,822977260.00,United States,2013,3360816,Consumer Services,Real Estate Investment Trusts
ORCC,Owl Rock Capital Corporation Common Stock,$14.34,-0.04,-0.278%,5637807624.00,,2019,688286,Finance,Diversified Financial Services
ORCL,Oracle Corporation Common Stock,$95.4644,-0.1456,-0.152%,260969697406.00,United States,1986,3182041,Technology,Computer Software: Prepackaged Software
ORI,Old Republic International Corporation Common Stock,$25.61,-0.15,-0.582%,7862493678.00,United States,,376664,Finance,Specialty Insurers
OSCR,Oscar Health Inc. Class A Common Stock,$11.68,-0.25,-2.096%,2447144661.00,,2021,538267,Finance,Accident &Health Insurance
OSH,Oak Street Health Inc. Common Stock,$39.79,-0.81,-1.995%,9586499018.00,United States,2020,716591,Health Care,Assisted Living Services
OSK,Oshkosh Corporation (Holding Company)Common Stock,$113.51,-1.56,-1.356%,7790855674.00,United States,,301210,Capital Goods,Auto Manufacturing
OTIS,Otis Worldwide Corporation Common Stock ,$85.43,0.91,1.077%,36288012680.00,,2020,1247248,,
OUST,Ouster Inc. Common Stock,$6.848,-0.362,-5.021%,1167880409.00,United States,2020,1038689,Capital Goods,Industrial Machinery/Components
OUT,OUTFRONT Media Inc. Common Stock,$27.735,-0.125,-0.449%,4038709461.00,,2014,236098,Consumer Services,Real Estate Investment Trusts
OVV,Ovintiv Inc. (DE),$35.07,-0.76,-2.121%,9156230785.00,Canada,,1177906,Energy,Oil & Gas Production
OWL,Blue Owl Capital Inc. Class A Common Stock,$16.19,0.19,1.188%,5904446616.00,United States,2020,897896,Finance,Investment Managers
OWLT,Owlet Inc. Class A Common Stock,$4.485,-0.035,-0.774%,505687338.00,,2020,194815,Health Care,Biotechnology: Electromedical & Electrotherapeutic Apparatus
OXM,Oxford Industries Inc. Common Stock,$104.35,0.00,0.00%,1763003998.00,United States,,18422,Consumer Non-Durables,Apparel
OXY,Occidental Petroleum Corporation Common Stock,$31.145,-0.695,-2.183%,29088837653.00,United States,,7148817,Energy,Oil & Gas Production
PAC,Grupo Aeroportuario Del Pacifico S.A. B. de C.V. Grupo Aeroportuario Del Pacifico S.A. de C.V. (each representing 10 Series B shares),$129.12,0.20,0.155%,6645875092.00,Mexico,2006,23718,,
PACK,Ranpak Holdings Corp Class A Common Stock,$41.64,-0.24,-0.573%,3389282595.00,,2018,131876,Basic Industries,Containers/Packaging
PAG,Penske Automotive Group Inc. Common Stock,$98.5852,-12.9948,-11.646%,7718731980.00,United States,,592235,Consumer Services,Other Specialty Stores
PAGS,PagSeguro Digital Ltd. Class A Common Shares,$32.32,-3.66,-10.172%,10652435288.00,Cayman Islands,2018,3441737,Technology,EDP Services
PAM,Pampa Energia S.A. Pampa Energia S.A.,$18.015,0.275,1.55%,999039840.00,Argentina,,80295,Public Utilities,Electric Utilities: Central
PAR,PAR Technology Corporation Common Stock,$65.99,-0.75,-1.124%,1772804259.00,United States,,82594,Technology,Computer Software: Prepackaged Software
PARR,Par Pacific Holdings Inc.  Common Stock,$15.04,-0.62,-3.959%,905273678.00,United States,,101746,Energy,Integrated oil Companies
PATH,UiPath Inc. Class A Common Stock,$55.13,-0.82,-1.466%,28311201475.00,,2021,1651017,Technology,Computer Software: Prepackaged Software
PAY,Paymentus Holdings Inc. Class A Common Stock,$30.005,0.185,0.62%,3601288345.00,,2021,147304,Technology,Retail: Computer Software & Peripheral Equipment
PAYC,Paycom Software Inc. Common Stock,$476.155,-9.845,-2.026%,28581593846.00,,2014,127221,Technology,Computer Software: Prepackaged Software
PB,Prosperity Bancshares Inc. Common Stock,$75.31,-0.70,-0.921%,6940942761.00,United States,,91543,Finance,Major Banks
PBA,Pembina Pipeline Corp. Ordinary Shares (Canada),$32.99,-0.11,-0.332%,18152912450.00,Canada,,418943,Energy,Oil & Gas Production
PBF,PBF Energy Inc. Class A Common Stock,$14.25,-1.32,-8.478%,1713498731.00,United States,2012,1801190,Energy,Integrated oil Companies
PBFX,PBF Logistics LP Common Units representing limited partner interests,$12.905,-0.135,-1.035%,806783653.00,,2014,35291,,
PBH,Prestige Consumer Healthcare Inc. Common Stock,$61.32,-0.01,-0.016%,3072387153.00,United States,2005,46000,Health Care,Biotechnology: Pharmaceutical Preparations
PBI,Pitney Bowes Inc. Common Stock,$7.765,-0.105,-1.334%,1367141650.00,United States,,795035,Miscellaneous,Office Equipment/Supplies/Services
PBR,Petroleo Brasileiro S.A.- Petrobras Common Stock,$10.09,-0.20,-1.944%,65807995357.00,Brazil,,10658022,Energy,Oil & Gas Production
PBT,Permian Basin Royalty Trust Common Stock,$8.701,0.161,1.885%,405543134.00,United States,,206661,Energy,Oil & Gas Production
PCG,Pacific Gas & Electric Co. Common Stock,$12.38,0.06,0.487%,24578870708.00,United States,,7025169,Public Utilities,Power Generation
PCI,PIMCO Dynamic Credit and Mortgage Income Fund Common Shares of Beneficial Interest,$21.1317,-0.1583,-0.744%,3214871180.00,,2013,283548,Finance,Investment Managers
PCK,Pimco California Municipal Income Fund II Common Shares of Beneficial Interest,$9.7098,-0.0902,-0.92%,312496067.00,United States,2002,19364,Finance,Trusts Except Educational Religious and Charitable
PCN,Pimco Corporate & Income Strategy Fund Common Stock,$18.33,-0.13,-0.704%,763939410.00,United States,2001,101761,Finance,Investment Managers
PCOR,Procore Technologies Inc. Common Stock,$87.44,0.48,0.552%,11614497371.00,,2021,208048,Technology,EDP Services
PCPC,Periphas Capital Partnering Corporation Class A Common Stock,$24.47,0.07,0.287%,434430592.00,,2021,11462,,
PCQ,PIMCO California Municipal Income Fund Common Stock,$19.6503,-0.0897,-0.454%,371545770.00,United States,2001,3545,Finance,Investment Managers
PD,PagerDuty Inc. Common Stock,$41.19,-0.76,-1.812%,3500015833.00,,2019,228636,Technology,Retail: Computer Software & Peripheral Equipment
PDI,PIMCO Dynamic Income Fund Common Stock,$26.495,-0.115,-0.432%,1870494010.00,United States,2012,252173,Finance,Trusts Except Educational Religious and Charitable
PDM,Piedmont Office Realty Trust Inc. Class A Common Stock,$18.63,-0.28,-1.481%,2312668994.00,United States,,273561,Consumer Services,Building operators
PDO,PIMCO Dynamic Income Opportunities Fund Common Shares of Beneficial Interest,$20.45,-0.04,-0.195%,1443729100.00,,2021,167762,Finance,Trusts Except Educational Religious and Charitable
PDOT,Peridot Acquisition Corp. II Class A Ordinary Shares,$9.80,0.00,0.00%,500357081.00,,2021,1,,
PDS,Precision Drilling Corporation Common Stock,$37.7309,-0.9191,-2.378%,501987929.00,Canada,,10904,,
PDT,John Hancock Premium Dividend Fund,$17.601,0.151,0.865%,858071631.00,United States,,50422,Finance,Finance Companies
PEAK,Healthpeak Properties Inc. Common Stock,$34.525,0.345,1.009%,18611468499.00,United States,,1172506,Consumer Services,Real Estate Investment Trusts
PEB,Pebblebrook Hotel Trust Common Shares of Beneficial Interest,$23.31,-0.31,-1.312%,3062526425.00,United States,2009,225773,Consumer Services,Real Estate Investment Trusts
PEG,Public Service Enterprise Group Incorporated Common Stock,$62.60,-0.12,-0.191%,31654545867.00,United States,,507038,Public Utilities,Electric Utilities: Central
PEN,Penumbra Inc. Common Stock,$271.095,5.675,2.138%,10127774398.00,,2015,37812,Health Care,Medical/Dental Instruments
PEO,Adams Natural Resources Fund Inc. Common Stock,$17.4039,-0.1561,-0.889%,419170826.00,United States,,52557,Consumer Services,Real Estate Investment Trusts
PFE,Pfizer Inc. Common Stock,$50.555,0.955,1.925%,283758470862.00,United States,,21181322,Health Care,Biotechnology: Pharmaceutical Preparations
PFGC,Performance Food Group Company Common Stock,$45.10,-0.79,-1.722%,6959591166.00,United States,2015,523111,Consumer Non-Durables,Food Distributors
PFL,PIMCO Income Strategy Fund Shares of Beneficial Interest,$11.145,-0.005,-0.045%,382061745.00,United States,2003,53332,Finance,Finance Companies
PFN,PIMCO Income Strategy Fund II,$9.8088,-0.0612,-0.62%,753865133.00,United States,2004,208688,Finance,Finance/Investors Services
PFS,Provident Financial Services Inc Common Stock,$24.665,-0.345,-1.379%,1908446507.00,United States,2003,32824,Finance,Savings Institutions
PFSI,PennyMac Financial Services Inc. Common Stock,$62.39,-0.71,-1.125%,3682832412.00,United States,2013,167804,Finance,Finance: Consumer Services
PG,Procter & Gamble Company (The) Common Stock,$147.44,0.25,0.17%,356797106433.00,United States,,2285055,Consumer Non-Durables,Package Goods/Cosmetics
PGR,Progressive Corporation (The) Common Stock,$91.635,-2.245,-2.391%,53606475000.00,United States,,2412201,Finance,Property-Casualty Insurers
PGRE,Paramount Group Inc. Common Stock,$9.08,-0.20,-2.155%,1988124166.00,United States,2014,388556,Consumer Services,Real Estate Investment Trusts
PGTI,PGT Innovations Inc.,$22.03,-0.26,-1.166%,1312704430.00,United States,2006,70790,Capital Goods,Building Products
PH,Parker-Hannifin Corporation Common Stock,$329.69,-2.79,-0.839%,42370094855.00,United States,,195042,Capital Goods,Office Equipment/Supplies/Services
PHG,Koninklijke Philips N.V. NY Registry Shares,$41.4846,-0.1854,-0.445%,37763680288.00,Netherlands,,597276,Health Care,Biotechnology: Electromedical & Electrotherapeutic Apparatus
PHI,PLDT Inc. Sponsored ADR,$33.98,-0.68,-1.962%,7339680000.00,Philippines,,8652,Public Utilities,Telecommunications Equipment
PHK,Pimco High Income Fund Pimco High Income Fund,$6.285,-0.015,-0.238%,841586640.00,United States,2003,256461,Finance,Finance/Investors Services
PHM,PulteGroup Inc. Common Stock,$51.74,0.22,0.427%,13099826411.00,United States,,571121,,
PHR,Phreesia Inc. Common Stock,$73.12,-0.24,-0.327%,3720018242.00,United States,2019,67992,Health Care,Managed Health Care
PHT,Pioneer High Income Fund Inc.,$10.25,-0.10,-0.966%,300310906.00,United States,,48440,Finance,Investment Managers
PIAI,Prime Impact Acquisition I Class A Ordinary Shares,$9.84,0.00,0.00%,355842592.00,,2020,69182,Finance,Business Services
PICC,Pivotal Investment Corporation III Class A Common Stock,$9.75,0.01,0.103%,336375000.00,,2021,475,,
PII,Polaris Inc. Common Stock,$122.64,-2.54,-2.029%,7442011169.00,United States,,151669,Consumer Non-Durables,Recreational Products/Toys
PING,Ping Identity Holding Corp. Common Stock,$27.97,-0.37,-1.306%,2337803951.00,United States,2019,445221,Technology,EDP Services
PINS,Pinterest Inc. Class A Common Stock,$48.01,-0.78,-1.599%,31311954061.00,,2019,3306203,,
PIPR,Piper Sandler Companies Common Stock,$186.79,-1.22,-0.649%,3339468044.00,United States,,14912,Finance,Investment Bankers/Brokers/Service
PJT,PJT Partners Inc. Class A Common Stock,$81.35,-0.59,-0.72%,1974177883.00,United States,2015,35844,Finance,Investment Managers
PK,Park Hotels & Resorts Inc. Common Stock ,$19.085,-0.295,-1.522%,4513205131.00,United States,2016,896196,Consumer Services,Real Estate Investment Trusts
PKG,Packaging Corporation of America Common Stock,$134.925,0.365,0.271%,12816629103.00,United States,2000,268166,Basic Industries,Paper
PKI,PerkinElmer Inc. Common Stock,$188.81,1.30,0.693%,23827858252.00,United States,,281419,Health Care,Medical Specialities
PKO,Pimco Income Opportunity Fund Common Shares of Beneficial Interest,$24.64,-0.03,-0.122%,517735680.00,United States,,27363,Finance,Finance/Investors Services
PKX,POSCO Common Stock,$57.77,-1.50,-2.531%,17475557178.00,South Korea,1994,119397,Basic Industries,Steel/Iron Ore
PLAN,Anaplan Inc. Common Stock,$61.00,-0.59,-0.958%,8917141040.00,United States,2018,748913,Technology,Computer Software: Prepackaged Software
PLD,Prologis Inc. Common Stock,$149.40,-0.07,-0.047%,110455453800.00,United States,,795421,Consumer Services,Real Estate Investment Trusts
PLNT,Planet Fitness Inc. Common Stock,$91.425,-0.575,-0.625%,7619776764.00,United States,2015,338007,Consumer Services,Other Consumer Services
PLOW,Douglas Dynamics Inc. Common Stock,$45.31,-0.19,-0.418%,1041266890.00,United States,2010,38624,Capital Goods,Construction/Ag Equipment/Trucks
PLTR,Palantir Technologies Inc. Class A Common Stock,$22.545,-0.585,-2.529%,45198687867.00,,2020,19345404,Technology,Retail: Computer Software & Peripheral Equipment
PLYM,Plymouth Industrial REIT Inc. Common Stock,$29.15,-0.09,-0.308%,1008749130.00,United States,2017,156099,Consumer Services,Real Estate Investment Trusts
PM,Philip Morris International Inc Common Stock,$93.365,0.295,0.317%,145353216343.00,United States,,2374513,Consumer Non-Durables,Farming/Seeds/Milling
PMF,PIMCO Municipal Income Fund Common Stock,$14.555,-0.015,-0.103%,378616595.00,United States,2001,11267,Finance,Finance/Investors Services
PML,Pimco Municipal Income Fund II Common Shares of Beneficial Interest,$14.225,-0.015,-0.105%,899853585.00,United States,2002,48507,Finance,Investment Managers
PMM,Putnam Managed Municipal Income Trust Common Stock,$8.65,0.05,0.581%,422892177.00,United States,1989,46798,Finance,Investment Managers
PMO,Putnam Municipal Opportunities Trust Common Stock,$14.30,0.14,0.989%,487768510.00,United States,1993,22803,Finance,Finance Companies
PMT,PennyMac Mortgage Investment Trust Common Shares of Beneficial Interest,$18.38,-0.33,-1.764%,1782983036.00,United States,2009,480477,Consumer Services,Real Estate Investment Trusts
PMX,PIMCO Municipal Income Fund III Common Shares of Beneficial Interest,$12.3324,-0.0576,-0.465%,409899095.00,United States,2002,8400,Finance,Trusts Except Educational Religious and Charitable
PNC,PNC Financial Services Group Inc. (The) Common Stock,$203.29,-2.24,-1.09%,85918649655.00,United States,,555934,Finance,Major Banks
PNM,PNM Resources Inc. (Holding Co.) Common Stock,$49.70,0.02,0.04%,4265993238.00,United States,,457138,Public Utilities,Electric Utilities: Central
PNR,Pentair plc. Ordinary Share,$77.29,-0.05,-0.065%,12789811547.00,Switzerland,,267960,Capital Goods,Fluid Controls
PNTM,Pontem Corporation Class A Ordinary Shares,$9.79,-0.03,-0.305%,844387500.00,,2021,32155,Finance,Business Services
PNW,Pinnacle West Capital Corporation Common Stock,$66.245,0.125,0.189%,7473682930.00,United States,,428162,Public Utilities,Electric Utilities: Central
POLY,Plantronics Inc. Common Stock,$29.08,-0.41,-1.39%,1242633736.00,United States,,148372,Public Utilities,Telecommunications Equipment
POND,Angel Pond Holdings Corporation Class A Ordinary Shares,$9.74,0.02,0.206%,323264288.00,,2021,1200,,
POR,Portland General Electric Co Common Stock,$49.12,-0.22,-0.446%,4391800191.00,United States,,124492,Public Utilities,Electric Utilities: Central
POST,Post Holdings Inc. Common Stock,$105.44,-0.92,-0.865%,6717294022.00,United States,2012,146432,Consumer Non-Durables,Specialty Foods
PPG,PPG Industries Inc. Common Stock,$163.74,-1.10,-0.667%,38872015670.00,United States,,410471,Basic Industries,Paints/Coatings
PPL,PPL Corporation Common Stock,$28.638,-0.062,-0.216%,21499002001.00,United States,,1575769,Public Utilities,Electric Utilities: Central
PPT,Putnam Premier Income Trust Common Stock,$4.48,0.01,0.224%,457910401.00,United States,1988,165089,Finance,Finance Companies
PRA,ProAssurance Corporation Common Stock,$23.96,-0.43,-1.763%,1293446122.00,United States,,68252,Finance,Property-Casualty Insurers
PRG,PROG Holdings Inc. Common Stock,$47.88,-0.54,-1.115%,3130934726.00,United States,,199971,Technology,Diversified Commercial Services
PRGO,Perrigo Company plc Ordinary Shares,$42.91,-0.08,-0.186%,5740237234.00,United States,,539008,Health Care,Biotechnology: Pharmaceutical Preparations
PRI,Primerica Inc. Common Stock,$160.44,0.17,0.106%,6335752497.00,United States,2010,37318,Finance,Life Insurance
PRLB,Proto Labs Inc. Common stock,$56.20,-1.96,-3.37%,1550538274.00,United States,2012,130824,Capital Goods,Office Equipment/Supplies/Services
PRM,Perimeter Solutions SA Ordinary Shares,$12.94,-0.45,-3.361%,2033358085.00,,2021,120011,,
PRMW,Primo Water Corporation Common Stock,$19.38,-0.23,-1.173%,3102713329.00,Canada,,505251,Consumer Non-Durables,Soft Drinks
PRO,PROS Holdings Inc. Common Stock,$38.535,0.755,1.998%,1710650691.00,United States,2007,232211,Technology,EDP Services
PRPB,CC Neuberger Principal Holdings II Class A Ordinary Shares,$9.89,-0.02,-0.202%,1073065000.00,United States,2020,26657,Finance,Business Services
PRPC,CC Neuberger Principal Holdings III Class A Ordinary Shares,$9.77,-0.04,-0.408%,540403125.00,,2021,100,Finance,Business Services
PRS,Prudential Financial Inc. 5.625% Junior Subordinated Notes due 2058,$26.60,-0.06,-0.225%,906037682.00,United States,2018,14707,Finance,Investment Bankers/Brokers/Service
PRTY,Party City Holdco Inc. Common Stock,$6.80,-0.06,-0.875%,763132604.00,United States,2015,2623771,Miscellaneous,Diversified Commercial Services
PRU,Prudential Financial Inc. Common Stock,$110.4717,-0.8183,-0.735%,41758302600.00,United States,2001,685841,Finance,Life Insurance
PSA,Public Storage Common Stock,$331.42,3.24,0.987%,58116008275.00,United States,,167622,Consumer Services,Real Estate Investment Trusts
PSB,PS Business Parks Inc. (MD) Common Stock,$176.02,-0.38,-0.215%,4849455732.00,United States,,18148,Consumer Services,Real Estate Investment Trusts
PSF,Cohen & Steers Select Preferred and Income Fund Inc. Common Stock,$29.15,-0.13,-0.444%,350364577.00,,2010,4686,Finance,Investment Managers
PSFE,Paysafe Limited Common Shares,$4.235,-0.195,-4.402%,3064921938.00,,2021,14520915,Miscellaneous,Business Services
PSN,Parsons Corporation Common Stock,$35.945,0.605,1.712%,3675655902.00,,2019,108808,Capital Goods,Industrial Machinery/Components
PSO,Pearson Plc Common Stock,$8.655,0.065,0.757%,6549905653.00,United Kingdom,,142378,Consumer Services,Books
PSPC,Post Holdings Partnering Corporation Series A Common Stock,$9.72,-0.01,-0.103%,429769800.00,,2021,350,,
PSTG,Pure Storage Inc. Class A Common Stock,$27.80,-0.33,-1.173%,7925059480.00,,2015,1504041,Technology,Electronic Components
PSTH,Pershing Square Tontine Holdings Ltd. Class A Common Stock,$19.81,0.00,0.00%,3962001981.00,,2020,248182,,
PSX,Phillips 66 Common Stock,$74.74,-2.25,-2.922%,32748847400.00,United States,,920642,Energy,Integrated oil Companies
PSXP,Phillips 66 Partners LP Common Units representing limited partner interest in the Partnership,$37.20,-1.19,-3.10%,8494253431.00,United States,2013,331406,Energy,Oil & Gas Production
PTA,Cohen & Steers Tax-Advantaged Preferred Securities and Income Fund Common Shares of Beneficial Interest,$24.64,-0.03,-0.122%,1361937980.00,,2020,74579,Finance,Trusts Except Educational Religious and Charitable
PTR,PetroChina Company Limited Common Stock,$46.01,0.21,0.459%,84207951886.00,China,,68020,Energy,Oil & Gas Production
PTY,Pimco Corporate & Income Opportunity Fund,$18.4587,-0.0613,-0.331%,2106322257.00,United States,2002,268009,Finance,Investment Managers
PUK,Prudential Public Limited Company Common Stock,$40.239,0.039,0.097%,55256408308.00,United Kingdom,,48208,Finance,Life Insurance
PUMP,ProPetro Holding Corp. Common Stock,$8.53,-0.43,-4.799%,881757317.00,United States,2017,254503,Energy,Oilfield Services/Equipment
PV,Primavera Capital Acquisition Corporation Class A Ordinary Shares,$9.765,-0.015,-0.153%,524868750.00,,2021,40352,Finance,Business Services
PVG,Pretium Resources Inc. Ordinary Shares (Canada),$14.46,0.06,0.417%,2717005933.00,Canada,,900252,,
PVH,PVH Corp. Common Stock,$121.98,-1.28,-1.038%,8704459865.00,United States,,214639,,
PWR,Quanta Services Inc. Common Stock,$119.1337,-0.3563,-0.298%,16976466474.00,United States,,407877,Capital Goods,Engineering & Construction
PWSC,PowerSchool Holdings Inc. Class A Common Stock,$23.015,-0.125,-0.54%,4566218163.00,,2021,137721,Technology,Computer Software: Prepackaged Software
PX,P10 Inc. Class A Common Stock,$13.99,0.03,0.215%,1639006788.00,,2021,89276,Finance,Investment Managers
PXD,Pioneer Natural Resources Company Common Stock,$181.1669,-1.9031,-1.04%,44228945796.00,United States,,695863,Energy,Oil & Gas Production
PZN,Pzena Investment Management Inc Class A Common Stock,$11.38,-0.05,-0.437%,821311556.00,United States,2007,12485,Finance,Investment Managers
QD,Qudian Inc. American Depositary Shares each representing one Class A Ordinary Share,$1.695,-0.045,-2.586%,428984496.00,China,2017,423563,Technology,Computer Software: Prepackaged Software
QGEN,Qiagen N.V. Common Shares ,$54.61,-0.96,-1.728%,12414818960.00,Netherlands,,2132427,Health Care,Biotechnology: Biological Products (No Diagnostic Substances)
QS,QuantumScape Corporation Class A Common Stock,$35.98,-0.93,-2.52%,15205000482.00,United States,2020,9430194,Capital Goods,Auto Parts:O.E.M.
QSR,Restaurant Brands International Inc. Common Shares,$57.955,0.415,0.721%,18259985937.00,Canada,2014,650996,,
QTWO,Q2 Holdings Inc. Common Stock,$87.365,-1.375,-1.549%,4963802353.00,,2014,333823,Technology,EDP Services
QUOT,Quotient Technology Inc. Common Stock,$7.4716,-0.0084,-0.112%,705480860.00,,2014,1007850,Technology,Advertising
R,Ryder System Inc. Common Stock,$84.00,-2.39,-2.767%,4510234092.00,United States,,363693,Miscellaneous,Rental/Leasing Companies
RA,Brookfield Real Assets Income Fund Inc. Common Stock,$21.73,0.04,0.184%,996595124.00,,2016,122270,Finance,Investment Managers
RAAS,Cloopen Group Holding Limited American Depositary Shares each representing two Class A Ordinary Shares,$4.37,-0.06,-1.354%,718297660.00,,2021,670399,Technology,Computer Software: Prepackaged Software
RACE,Ferrari N.V. Common Shares,$265.77,7.88,3.056%,65744719005.00,,2015,612127,Capital Goods,Auto Manufacturing
RAD,Rite Aid Corporation Common Stock,$13.43,-0.24,-1.756%,749008062.00,United States,,1128524,Health Care,Medical/Nursing Services
RAMP,LiveRamp Holdings Inc. Common Stock,$55.17,-0.03,-0.054%,3756697541.00,United States,2018,346026,Technology,EDP Services
RBA,Ritchie Bros. Auctioneers Incorporated Common Stock,$72.44,-0.16,-0.22%,8008178543.00,Canada,,275386,,
RBAC,RedBall Acquisition Corp. Class A Ordinary Shares,$10.21,-0.04,-0.39%,733843750.00,United States,2020,835251,Finance,Business Services
RBLX,Roblox Corporation Class A Common Stock,$123.87,7.69,6.619%,71700371098.00,,2021,31972124,Technology,EDP Services
RBOT,Vicarious Surgical Inc. Class A Common Stock,$13.025,-0.025,-0.192%,1545055614.00,Hong Kong,2020,133194,Health Care,Medical Specialities
RC,Ready Capital Corproation Common Stock,$15.66,-0.09,-0.571%,1152478407.00,United States,2013,170298,Consumer Services,Real Estate Investment Trusts
RCI,Rogers Communication Inc. Common Stock,$47.17,-0.94,-1.954%,23817327250.00,Canada,,365626,,
RCL,D/B/A Royal Caribbean Cruises Ltd. Common Stock,$82.66,-0.68,-0.816%,21060928753.00,United States,1993,1195967,,
RCS,PIMCO Strategic Income Fund Inc.,$7.415,-0.025,-0.336%,329203755.00,United States,1994,34221,Finance,Investment Managers
RCUS,Arcus Biosciences Inc. Common Stock,$36.82,-0.50,-1.34%,2586585670.00,,2018,105095,Health Care,Biotechnology: Pharmaceutical Preparations
RDN,Radian Group Inc. Common Stock,$21.575,-0.625,-2.815%,3869112409.00,United States,,1261570,Finance,Property-Casualty Insurers
RDW,Redwire Corporation Common Stock,$10.01,-0.31,-3.004%,597209343.00,United States,2021,502244,Capital Goods,Aerospace
RDY,Dr. Reddy's Laboratories Ltd Common Stock,$63.46,-0.65,-1.014%,10526015264.00,India,,32753,Health Care,Biotechnology: Pharmaceutical Preparations
RE,Everest Re Group Ltd. Common Stock,$275.955,-2.585,-0.928%,10864079570.00,Bermuda,,54471,Finance,Property-Casualty Insurers
RELX,RELX PLC PLC American Depositary Shares (Each representing One Ordinary Share),$31.495,0.145,0.463%,60930922662.00,United Kingdom,2015,272344,Consumer Services,Publishing
RENN,Renren Inc. American Depositary Shares each representing fifteen Class A ordinary shares,$27.14,-0.04,-0.147%,651885322.00,China,2011,18126,Technology,EDP Services
RERE,AiHuiShou International Co. Ltd. American Depositary Shares (every three of which representing two Class A ordinary shares),$8.96,-0.12,-1.322%,1994808131.00,,2021,194250,,
RES,RPC Inc. Common Stock,$4.565,-0.405,-8.149%,984786615.00,United States,,689422,Energy,Oilfield Services/Equipment
REV,Revlon Inc. New Common Stock,$14.00,-0.09,-0.639%,751236808.00,United States,1996,42222,Consumer Non-Durables,Package Goods/Cosmetics
REVG,REV Group Inc. Common Stock,$17.55,-0.15,-0.847%,1136316800.00,United States,2017,55915,Capital Goods,Industrial Machinery/Components
REX,REX American Resources Corporation,$87.00,-0.16,-0.184%,519471606.00,United States,,9762,Basic Industries,Automotive Aftermarket
REXR,Rexford Industrial Realty Inc. Common Stock,$70.07,0.16,0.229%,10614721417.00,United States,2013,334083,Consumer Services,Real Estate Investment Trusts
REZI,Resideo Technologies Inc. Common Stock ,$27.1898,-0.6402,-2.30%,3925828013.00,,2018,233599,Miscellaneous,Diversified Manufacture
RF,Regions Financial Corporation Common Stock,$24.0524,-0.1976,-0.815%,22928734961.00,United States,,2106291,Finance,Major Banks
RFI,Cohen & Steers Total Return Realty Fund Inc. Common Stock,$17.05,-0.13,-0.757%,447919339.00,United States,1993,34856,Finance,Investment Managers
RFMZ,RiverNorth Flexible Municipal Income Fund II Inc. Common Stock,$20.37,0.10,0.493%,496045270.00,,2021,30200,Finance,Trusts Except Educational Religious and Charitable
